PHASE,COMPONENT,TASK_ID,TASK_NAME,DEPENDENCIES,EST_TIME,PRIORITY,OWNER,STATUS,SUCCESS_CRITERIA
9,Visual-Regression,VR-004,Compare new screenshots to baseline (dark),"[VR-002]","20min",P1,QA-Team-1,pending,"Visual regression test passes; no unexpected changes"
9,Visual-Regression,VR-005,Verify animations are smooth (manual videos),"[AP-002,VR-001]","30min",P1,QA-Team-1,pending,"Record videos of animations; no jank; 60 FPS evident"
9,Manual-QA,MQA-001,Manual test form validation,"[CM-004]","20min",P0,QA-Team-2,pending,"Test: empty input rejected; 10+ chars accepted; 2000 max"
9,Manual-QA,MQA-002,Manual test API success flow,"[API-001]","30min",P0,QA-Team-2,pending,"Submit valid incident; results display correctly; all sections filled"
9,Manual-QA,MQA-003,Manual test API network error,"[EC-001,ES-001]","20min",P0,QA-Team-2,pending,"Disconnect network; submit; error shown; reconnect; retry works"
9,Manual-QA,MQA-004,Manual test API timeout,"[TH-004,ES-004]","20min",P0,QA-Team-2,pending,"Wait 30+ seconds for response; timeout error shown; retry works"
9,Manual-QA,MQA-005,Manual test API rate limit,"[EC-002,ES-006]","20min",P0,QA-Team-2,pending,"Trigger rate limit (429); error shown; countdown timer visible"
9,Manual-QA,MQA-006,Manual test dark theme contrast,"[TT-005]","15min",P0,QA-Team-2,pending,"Dark theme all text ≥4.5:1 contrast; no eye strain"
9,Manual-QA,MQA-007,Manual test mobile responsiveness,"[RM-001]","20min",P0,QA-Team-2,pending,"Mobile layout: stacked; text readable; buttons 44px+"
9,Manual-QA,MQA-008,Manual test accessibility (keyboard only),"[AT-005]","30min",P0,QA-Team-2,pending,"Navigate entire page with keyboard; all features work"
9,Manual-QA,MQA-009,Manual test accessibility (screen reader),"[AT-003]","30min",P0,QA-Team-2,pending,"Use VoiceOver/NVDA; all content read; interactive elements announced"
9,Manual-QA,MQA-010,Manual test performance (Lighthouse),"[LT-001]","20min",P0,QA-Team-2,pending,"Run Lighthouse; score ≥90; all metrics in target"
10,Documentation-CLAUDE,DC-001,Add frontend standards to CLAUDE.md,"[DS-001]","30min",P0,Documentation-Team,pending,"CLAUDE.md updated with design tokens component API requirements"
10,Documentation-CLAUDE,DC-002,Document design token structure,"[DS-001]","20min",P0,Documentation-Team,pending,"All token definitions documented; usage examples provided"
10,Documentation-CLAUDE,DC-003,Document motion library reference,"[MU-010]","30min",P0,Documentation-Team,pending,"All motion utilities documented; examples for each function"
10,Documentation-CLAUDE,DC-004,Document API client reference,"[AC-012]","30min",P0,Documentation-Team,pending,"API client documented; error handling examples; retry logic"
10,Documentation-CLAUDE,DC-005,Document accessibility guidelines,"[AT-007]","20min",P0,Documentation-Team,pending,"A11y best practices documented; ARIA label examples"
10,Documentation-CLAUDE,DC-006,Add troubleshooting guide to CLAUDE.md,"[DC-001]","30min",P0,Documentation-Team,pending,"Common issues documented; solutions provided"
10,Component-Documentation,CD-001,Create COMPONENT_API.md file,"[]","20min",P0,Documentation-Team,pending,"File exists at docs/COMPONENT_API.md"
10,Component-Documentation,CD-002,Document Layout component,"[CD-001,RC-013]","20min",P0,Documentation-Team,pending,"Props; usage examples; visual hierarchy explained"
10,Component-Documentation,CD-003,Document ThemeToggle component,"[CD-001,RC-014]","15min",P0,Documentation-Team,pending,"Props; usage examples; theme switching explained"
10,Component-Documentation,CD-004,Document motion components,"[CD-001,MC-016]","30min",P0,Documentation-Team,pending,"AnimatedSection FadeIn ZoomIn etc documented; examples"
10,Component-Documentation,CD-005,Document loading components,"[CD-001,LS-015]","30min",P0,Documentation-Team,pending,"Skeleton ProgressBar LoadingAnimation etc documented"
10,Component-Documentation,CD-006,Document error components,"[CD-001,ES-015]","30min",P0,Documentation-Team,pending,"ErrorState variants OfflineState etc documented"
10,Component-Documentation,CD-007,Document empty state components,"[CD-001,EM-006]","20min",P0,Documentation-Team,pending,"EmptyState variants documented; usage guidelines"
10,Architecture-Documentation,AD-001,Create FRONTEND_ARCHITECTURE.md file,"[]","20min",P0,Documentation-Team,pending,"File exists at docs/FRONTEND_ARCHITECTURE.md"
10,Architecture-Documentation,AD-002,Document React component hierarchy,"[AD-001]","20min",P0,Documentation-Team,pending,"Component tree shown; provider structure explained"
10,Architecture-Documentation,AD-003,Document context API structure,"[AD-001,RC-008]","20min",P0,Documentation-Team,pending,"ThemeContext UIStateContext documented; data flow explained"
10,Architecture-Documentation,AD-004,Document API client architecture,"[AD-001,AC-012]","20min",P0,Documentation-Team,pending,"Error handling; retry logic; timeout handling explained"
10,Architecture-Documentation,AD-005,Document motion system architecture,"[AD-001,MU-010]","20min",P0,Documentation-Team,pending,"Tokens; utilities; components; interaction model explained"
10,Architecture-Documentation,AD-006,Document design token system,"[AD-001,DS-001]","20min",P0,Documentation-Team,pending,"Token structure; usage; theme switching explained"
10,Architecture-Documentation,AD-007,Create system design diagram (visual),"[AD-006]","30min",P1,Documentation-Team,pending,"Visual diagram of system architecture; flow clear"
10,Performance-Budget,PB-001,Create performance budget documentation,"[]","20min",P0,Documentation-Team,pending,"Performance budgets defined; targets clear"
10,Performance-Budget,PB-002,Document motion performance budget,"[PB-001,BO-006]","15min",P0,Documentation-Team,pending,"Motion library max 2MB; monitoring explained"
10,Performance-Budget,PB-003,Document bundle performance budget,"[PB-001,BO-006]","15min",P0,Documentation-Team,pending,"Bundle max 300KB gzipped; monitoring explained"
10,Performance-Budget,PB-004,Document LCP performance target,"[PB-001,WV-002]","15min",P0,Documentation-Team,pending,"LCP target <2.5s; optimization strategies documented"
10,Performance-Budget,PB-005,Document FID performance target,"[PB-001,WV-003]","15min",P0,Documentation-Team,pending,"FID target <100ms; optimization strategies documented"
10,Performance-Budget,PB-006,Document CLS performance target,"[PB-001,WV-004]","15min",P0,Documentation-Team,pending,"CLS target <0.1; optimization strategies documented"
10,Testing-Guide,TG-001,Create TESTING.md file (frontend),"[]","20min",P0,Documentation-Team,pending,"File exists at docs/FRONTEND_TESTING.md"
10,Testing-Guide,TG-002,Document unit test execution,"[TG-001]","15min",P0,Documentation-Team,pending,"npm test command documented; output explained"
10,Testing-Guide,TG-003,Document integration test execution,"[TG-001]","15min",P0,Documentation-Team,pending,"Integration test suites listed; how to run documented"
10,Testing-Guide,TG-004,Document E2E test execution,"[TG-001]","15min",P0,Documentation-Team,pending,"E2E test suites listed; how to run documented"
10,Testing-Guide,TG-005,Document visual regression testing,"[TG-001]","15min",P0,Documentation-Team,pending,"Visual regression process documented; how to review"
10,Testing-Guide,TG-006,Document manual QA checklist,"[TG-001]","20min",P0,Documentation-Team,pending,"Complete QA checklist provided; test scenarios"
10,Readiness-Check,RC-100,Verify all Phase 1 tasks complete,"[DT-010]","15min",P0,Project-Manager,pending,"DT-001 through DT-013 all done; no blockers"
10,Readiness-Check,RC-101,Verify all Phase 2 tasks complete,"[RI-007]","15min",P0,Project-Manager,pending,"RC-001 through RI-007 all done; no blockers"
10,Readiness-Check,RC-102,Verify all Phase 3 tasks complete,"[ME-010]","15min",P0,Project-Manager,pending,"MC-001 through ME-010 all done; no blockers"
10,Readiness-Check,RC-103,Verify all Phase 4 tasks complete,"[PUI-004]","15min",P0,Project-Manager,pending,"LS-001 through PUI-004 all done; no blockers"
10,Readiness-Check,RC-104,Verify all Phase 5 tasks complete,"[TT-007]","15min",P0,Project-Manager,pending,"DT-100 through TT-007 all done; no blockers"
10,Readiness-Check,RC-105,Verify all Phase 6 tasks complete,"[API-004]","15min",P0,Project-Manager,pending,"AC-001 through API-004 all done; no blockers"
10,Readiness-Check,RC-106,Verify all Phase 7 tasks complete,"[AT-007]","15min",P0,Project-Manager,pending,"AA-001 through AT-007 all done; no blockers"
10,Readiness-Check,RC-107,Verify all Phase 8 tasks complete,"[LT-005]","15min",P0,Project-Manager,pending,"BO-001 through LT-005 all done; no blockers"
10,Readiness-Check,RC-108,Verify all Phase 9 tasks complete,"[MQA-010]","15min",P0,Project-Manager,pending,"UT-001 through MQA-010 all done; 100% tests pass"
10,Readiness-Check,RC-109,Verify all Phase 10 tasks complete,"[TG-006]","15min",P0,Project-Manager,pending,"DC-001 through TG-006 all done; docs complete"
10,Final-Checklist,FC-001,Confirm zero console errors (desktop),"[RC-100,RC-101]","15min",P0,QA-Team-1,pending,"npm start; open localhost:3000; console clean"
10,Final-Checklist,FC-002,Confirm zero console errors (mobile),"[RC-100,RC-101]","15min",P0,QA-Team-1,pending,"Resize to mobile; console clean"
10,Final-Checklist,FC-003,Confirm all animations 60 FPS (desktop),"[AP-002]","15min",P0,QA-Team-1,pending,"DevTools Rendering: 60 FPS on all animations"
10,Final-Checklist,FC-004,Confirm all animations 60 FPS (mobile),"[AP-003]","15min",P0,QA-Team-1,pending,"DevTools Rendering on mobile: 60 FPS or simplified"
10,Final-Checklist,FC-005,Confirm dark theme readable,"[TT-005]","10min",P0,QA-Team-1,pending,"Dark theme: all text ≥4.5:1 contrast"
10,Final-Checklist,FC-006,Confirm bundle size <300KB,"[BO-006]","10min",P0,QA-Team-1,pending,"Gzipped bundle confirmed <300KB"
10,Final-Checklist,FC-007,Confirm Lighthouse score ≥90,"[LT-001]","10min",P0,QA-Team-1,pending,"Lighthouse audit: score ≥90"
10,Final-Checklist,FC-008,Confirm all critical workflows pass,"[IT-005]","20min",P0,QA-Team-1,pending,"Diagnosis flow; error recovery; theme switching all work"
10,Final-Checklist,FC-009,Confirm keyboard navigation works,"[AT-005]","15min",P0,QA-Team-1,pending,"Tab through entire page; all features accessible"
10,Final-Checklist,FC-010,Confirm accessibility WCAG AA,"[AT-001]","15min",P0,QA-Team-1,pending,"axe DevTools: 0 violations; WCAG AA compliant"
10,Final-Checklist,FC-011,Confirm all tests passing,"[MQA-010]","15min",P0,QA-Team-1,pending,"npm test: 100% of tests pass; coverage ≥80%"
10,Final-Checklist,FC-012,Confirm docs complete,"[TG-006]","15min",P0,Documentation-Team,pending,"All documentation files created; accurate; examples work"
10,Post-Launch,PL-001,Create git commit for Phase 10,"[]","20min",P0,Frontend-Team-1,pending,"Final commit with all Phase 10 work; clear message"
10,Post-Launch,PL-002,Merge to main branch,"[PL-001]","10min",P0,Backend-Team,pending,"Create PR; get approval; merge to main"
10,Post-Launch,PL-003,Deploy to production,"[PL-002]","20min",P0,DevOps-Team,pending,"Run deployment script; verify production working"
10,Post-Launch,PL-004,Monitor production metrics (1 week),"[PL-003]","5min/day",P0,DevOps-Team,pending,"Watch Lighthouse; Web Vitals; error rate; performance"
10,Post-Launch,PL-005,Gather user feedback,"[PL-003]","1h",P0,Product-Team,pending,"User testing; feedback collection; improvement list"
10,Post-Launch,PL-006,Plan Phase 2 improvements,"[PL-005]","2h",P0,Product-Team,pending,"Next improvement roadmap based on feedback"
