PHASE,COMPONENT,TASK_ID,TASK_NAME,DEPENDENCIES,EST_TIME,PRIORITY,OWNER,STATUS,SUCCESS_CRITERIA
5,Dark-Theme,DT-100,Create dark color palette tokens,"[DT-001]","30min",P0,Design-Team,pending,"tokens.colors.dark object created; minimum 8 colors with high contrast"
5,Dark-Theme,DT-101,Create dark theme color mappings,"[DT-100,SF-001]","30min",P0,Design-Team,pending,"Mapping defines dark variants for all light colors"
5,Dark-Theme,DT-102,Create dark shadow tokens,"[DT-005,DT-100]","20min",P0,Design-Team,pending,"Dark shadows defined for elevation; visible on dark backgrounds"
5,Dark-Theme,DT-103,Verify dark theme contrast (WCAG AA),"[DT-100,DT-102,SF-006]","30min",P0,QA-Team-1,pending,"All dark theme colors have 4.5:1+ contrast ratio"
5,Dark-Theme,DT-104,Create glassmorphism tokens,"[DT-100,DT-102]","20min",P0,Design-Team,pending,"Tokens for semi-transparent surfaces backdrop blur effects"
5,Theme-Switching,TS-001,Create useTheme hook with localStorage,"[RC-004]","20min",P0,Frontend-Team-2,pending,"Hook persists theme choice to localStorage; reads on page load"
5,Theme-Switching,TS-002,Implement theme persistence to localStorage,"[TS-001]","20min",P0,Frontend-Team-2,pending,"Theme choice saved to localStorage key; persists across sessions"
5,Theme-Switching,TS-003,Implement theme auto-detection from system,"[TS-001]","20min",P0,Frontend-Team-2,pending,"Detects prefers-color-scheme; uses as default if no localStorage"
5,Theme-Switching,TS-004,Implement smooth theme transition (0.3s),"[TS-001,DT-003]","30min",P0,Frontend-Team-2,pending,"Theme switch animates smoothly; transition time 300ms or less"
5,Theme-Switching,TS-005,Unit test useTheme localStorage persistence,"[TS-001,TS-002]","20min",P0,QA-Team-1,pending,"Test covers: saves to localStorage; reads from localStorage; persists"
5,Theme-Switching,TS-006,Unit test system theme detection,"[TS-003]","15min",P0,QA-Team-1,pending,"Test covers: prefers-color-scheme detected; correct default used"
5,Theme-Switching,TS-007,Unit test theme transition animation,"[TS-004]","20min",P0,QA-Team-1,pending,"Test covers: CSS transition applied; duration correct; smooth"
5,Responsive-Desktop,RD-001,Verify desktop layout (1200px+) shows all features,"[RC-010]","20min",P0,QA-Team-1,pending,"Desktop view shows: full header navigation all animations"
5,Responsive-Desktop,RD-002,Verify desktop animations render at 60 FPS,"[ME-003,ME-005]","30min",P1,QA-Team-1,pending,"DevTools Rendering tab shows 60 FPS; no jank; smooth transitions"
5,Responsive-Tablet,RT-001,Verify tablet layout (768-1199px) optimized,"[RC-010]","20min",P0,QA-Team-1,pending,"Tablet view shows: side panel collapses; font sizes scale; touch-friendly"
5,Responsive-Tablet,RT-002,Reduce parallax on tablet,"[MC-007]","20min",P0,Frontend-Team-2,pending,"Parallax effect reduced on tablet; 50% depth; still smooth"
5,Responsive-Tablet,RT-003,Optimize animations for tablet performance,"[ME-008]","20min",P0,Frontend-Team-2,pending,"Some animations disabled on tablet if performance drops; fallback to simpler version"
5,Responsive-Mobile,RM-001,Verify mobile layout (<768px) touch-friendly,"[RC-010]","20min",P0,QA-Team-1,pending,"Mobile view shows: stacked layout; buttons 44px+ height; readable text"
5,Responsive-Mobile,RM-002,Disable hover states on mobile,"[ME-003]","20min",P0,Frontend-Team-2,pending,"Hover states converted to active/focus on mobile; no touch hover"
5,Responsive-Mobile,RM-003,Simplify animations on mobile,"[MC-002]","20min",P0,Frontend-Team-2,pending,"Complex animations simplified or disabled; scroll-triggered animations may be removed"
5,Responsive-Mobile,RM-004,Remove parallax on mobile,"[MC-007]","20min",P0,Frontend-Team-2,pending,"Parallax effect disabled on mobile; fallback to static or subtle effect"
5,Responsive-Mobile,RM-005,Optimize font sizes for mobile readability,"[DT-002]","20min",P0,Frontend-Team-1,pending,"Typography adjusted for mobile; minimum 16px base; clear hierarchy"
5,Glassmorphism,GM-001,Implement glassmorphism cards (dark theme),"[DT-104,SF-001]","30min",P0,Frontend-Team-2,pending,"Cards use semi-transparent background; backdrop blur applied; elevated"
5,Glassmorphism,GM-002,Implement glassmorphism modals (dark theme),"[DT-104,SF-001]","30min",P0,Frontend-Team-2,pending,"Modals use glassmorphism effect; semi-transparent; backdrop blurred"
5,Glassmorphism,GM-003,Ensure glassmorphism contrast (WCAG AA),"[GM-001,GM-002,SF-006]","20min",P0,QA-Team-1,pending,"Text on glassmorphism surfaces has 4.5:1+ contrast; readable"
5,Theme-Testing,TT-001,Manual test light theme colors (desktop),"[DT-103,RD-001]","20min",P1,QA-Team-1,pending,"Light theme: all colors correct; text readable; buttons clear"
5,Theme-Testing,TT-002,Manual test dark theme colors (desktop),"[DT-103,RD-001]","20min",P1,QA-Team-1,pending,"Dark theme: all colors correct; text readable 4.5:1+; buttons clear"
5,Theme-Testing,TT-003,Manual test theme toggle (desktop),"[TS-005,RD-001]","20min",P1,QA-Team-1,pending,"Click toggle; theme switches instantly; localStorage persists"
5,Theme-Testing,TT-004,Manual test theme toggle (mobile),"[TS-005,RM-001]","20min",P1,QA-Team-1,pending,"Click toggle on mobile; theme switches; persists across sessions"
5,Theme-Testing,TT-005,Manual test dark theme contrast (axe DevTools),"[DT-103,TT-002]","20min",P1,QA-Team-1,pending,"Run axe DevTools; all colors pass WCAG AA minimum"
5,Theme-Testing,TT-006,Manual test responsive breakpoints (tablet),"[RT-001,TT-001]","20min",P1,QA-Team-1,pending,"Resize to tablet; layout adjusts; no text overflow; buttons clickable"
5,Theme-Testing,TT-007,Manual test responsive breakpoints (mobile),"[RM-001,TT-001]","20min",P1,QA-Team-1,pending,"Resize to mobile; layout stacks; text readable; buttons 44px+"
6,API-Client,AC-001,Create API client module,"[]","30min",P0,Frontend-Team-1,pending,"File exists at src/www/api/client.js; exports functions"
6,API-Client,AC-002,Implement diagnoseIncident function,"[AC-001]","30min",P0,Frontend-Team-1,pending,"Function accepts incident string; returns diagnosis object; handles errors"
6,API-Client,AC-003,Implement classifyError function,"[AC-001]","30min",P0,Frontend-Team-1,pending,"Function classifies error type: network timeout rate-limit auth server unknown"
6,API-Client,AC-004,Implement getUserFacingMessage function,"[AC-001]","20min",P0,Frontend-Team-1,pending,"Function returns user-friendly message for each error type"
6,API-Client,AC-005,Implement shouldRetry function,"[AC-001]","20min",P0,Frontend-Team-1,pending,"Function determines if error is retryable; ignores 400 403 404"
6,API-Client,AC-006,Implement getRetryDelay function,"[AC-001]","20min",P0,Frontend-Team-1,pending,"Function returns exponential backoff: 1s 2s 4s"
6,API-Client,AC-007,Unit test diagnoseIncident success,"[AC-002]","20min",P0,QA-Team-1,pending,"Test covers: successful request; returns diagnosis object; all fields present"
6,API-Client,AC-008,Unit test diagnoseIncident error handling,"[AC-002,AC-003]","30min",P0,QA-Team-1,pending,"Test covers: network error timeout rate limit auth server errors"
6,API-Client,AC-009,Unit test classifyError function,"[AC-003]","20min",P0,QA-Team-1,pending,"Test covers: all error types classified correctly"
6,API-Client,AC-010,Unit test getUserFacingMessage function,"[AC-004]","20min",P0,QA-Team-1,pending,"Test covers: user-friendly messages for all error types"
6,API-Client,AC-011,Unit test shouldRetry function,"[AC-005]","20min",P0,QA-Team-1,pending,"Test covers: retryable errors identified; non-retryable rejected"
6,API-Client,AC-012,Unit test getRetryDelay function,"[AC-006]","20min",P0,QA-Team-1,pending,"Test covers: exponential backoff calculated correctly; max 8s"
6,Retry-Logic,RL-001,Implement retry wrapper function,"[AC-002,AC-005,AC-006]","30min",P0,Frontend-Team-1,pending,"Function wraps API call; retries up to 3 times; exponential backoff"
6,Retry-Logic,RL-002,Implement exponential backoff with jitter,"[RL-001,AC-006]","20min",P0,Frontend-Team-1,pending,"Backoff includes jitter to avoid thundering herd"
6,Retry-Logic,RL-003,Implement max retry limit (3),"[RL-001]","10min",P0,Frontend-Team-1,pending,"After 3 failed retries; error is thrown"
6,Retry-Logic,RL-004,Unit test retry wrapper success after retries,"[RL-001]","20min",P0,QA-Team-1,pending,"Test covers: fails once; succeeds on retry; total attempts 2"
6,Retry-Logic,RL-005,Unit test retry wrapper failure after max retries,"[RL-003]","20min",P0,QA-Team-1,pending,"Test covers: fails 3 times; error thrown; no more retries"
6,Retry-Logic,RL-006,Unit test exponential backoff timing,"[RL-002,AC-006]","30min",P0,QA-Team-1,pending,"Test covers: backoff delays correct; jitter applied; total time reasonable"
6,Timeout-Handling,TH-001,Implement timeout logic (30 seconds),"[AC-002]","20min",P0,Frontend-Team-1,pending,"API call aborted if no response after 30 seconds"
6,Timeout-Handling,TH-002,Implement timeout error classification,"[TH-001,AC-003]","10min",P0,Frontend-Team-1,pending,"Timeout errors classified separately from network errors"
6,Timeout-Handling,TH-003,Implement timeout UI feedback,"[TH-001,ES-004]","20min",P0,Frontend-Team-2,pending,"User shown timeout error; manual retry button; countdown timer"
6,Timeout-Handling,TH-004,Unit test timeout after 30 seconds,"[TH-001]","20min",P0,QA-Team-1,pending,"Test covers: request aborted after 30s; error thrown; retryable"
6,Timeout-Handling,TH-005,Unit test timeout error message,"[TH-002,TH-003]","15min",P0,QA-Team-1,pending,"Test covers: user-friendly timeout message; retry option"
6,Error-Classification,EC-001,Classify network errors (offline timeout connection reset),"[AC-003]","20min",P0,Frontend-Team-1,pending,"Network error type detected; user-friendly message"
6,Error-Classification,EC-002,Classify rate limit errors (429),"[AC-003]","10min",P0,Frontend-Team-1,pending,"Rate limit detected; shows wait time if available"
6,Error-Classification,EC-003,Classify invalid input errors (400),"[AC-003]","10min",P0,Frontend-Team-1,pending,"Invalid input detected; shows field-level errors"
6,Error-Classification,EC-004,Classify auth errors (401 403),"[AC-003]","10min",P0,Frontend-Team-1,pending,"Auth error detected; suggests re-login or contact support"
6,Error-Classification,EC-005,Classify server errors (5xx),"[AC-003]","10min",P0,Frontend-Team-1,pending,"Server error detected; suggests retry; shows trace ID"
6,Error-Classification,EC-006,Classify unknown errors,"[AC-003]","10min",P0,Frontend-Team-1,pending,"Unknown error type; safe fallback message"
6,Error-Classification,EC-007,Unit test error classification (all types),"[EC-001,EC-002,EC-003,EC-004,EC-005,EC-006]","30min",P0,QA-Team-1,pending,"Test covers: all error types classified correctly"
6,Progress-Feedback,PF-001,Implement onProgress callback,"[AC-002]","20min",P0,Frontend-Team-1,pending,"API client supports onProgress callback; fires for each stage"
6,Progress-Feedback,PF-002,Update Progress Bar based on onProgress,"[PF-001,LS-006]","20min",P0,Frontend-Team-2,pending,"Progress bar shows current stage; updates in real-time"
6,Progress-Feedback,PF-003,Show stage labels in progress,"[PF-002]","15min",P0,Frontend-Team-2,pending,"Progress shows: Router Retriever Skeptic Verifier stages"
6,Progress-Feedback,PF-004,Unit test onProgress callback fires,"[PF-001]","20min",P0,QA-Team-1,pending,"Test covers: callback fires for each stage; data correct"
6,Progress-Feedback,PF-005,Unit test progress bar updates correctly,"[PF-002]","20min",P0,QA-Team-1,pending,"Test covers: progress bar shows current stage; updates smooth"
6,API-Integration,API-001,Wire API client to DiagnosisForm,"[AC-002,CM-004,PUI-002]","20min",P0,Frontend-Team-2,pending,"Form submission calls API; shows progress; displays results"
6,API-Integration,API-002,Wire error handling to ErrorState,"[EC-007,ES-001,PUI-003]","20min",P0,Frontend-Team-2,pending,"API errors display in ErrorState; matches error type"
6,API-Integration,API-003,Wire retry logic to UI,"[RL-001,API-002]","20min",P0,Frontend-Team-2,pending,"User can click retry button; same request retried with backoff"
6,API-Integration,API-004,Wire timeout handling to UI,"[TH-003,API-002]","20min",P0,Frontend-Team-2,pending,"Timeout displays error; manual retry option; countdown timer"
7,Accessibility-ARIA,AA-001,Add aria-label to buttons without visible text,"[]","30min",P0,Frontend-Team-1,pending,"All buttons without visible labels have aria-label"
7,Accessibility-ARIA,AA-002,Add aria-live regions for dynamic content,"[RC-001]","30min",P0,Frontend-Team-1,pending,"Dynamic content updates announced to screen readers"
7,Accessibility-ARIA,AA-003,Add aria-expanded to collapsible sections,"[]","20min",P0,Frontend-Team-1,pending,"Collapsible sections have aria-expanded attribute"
7,Accessibility-ARIA,AA-004,Add aria-busy to loading states,"[LS-001]","20min",P0,Frontend-Team-1,pending,"Loading elements have aria-busy=true; false when loaded"
7,Accessibility-ARIA,AA-005,Add aria-invalid to form errors,"[CM-004]","20min",P0,Frontend-Team-1,pending,"Form fields with errors have aria-invalid=true"
7,Accessibility-ARIA,AA-006,Add aria-describedby to error messages,"[ES-001,AA-005]","20min",P0,Frontend-Team-1,pending,"Error descriptions linked to fields with aria-describedby"
7,Accessibility-ARIA,AA-007,Unit test ARIA labels (axe DevTools),"[AA-001,AA-002,AA-003,AA-004,AA-005,AA-006]","30min",P0,QA-Team-1,pending,"Run axe DevTools; all ARIA violations fixed"
7,Keyboard-Navigation,KN-001,Verify tab order follows visual flow,"[RC-010]","20min",P0,QA-Team-1,pending,"Tab through page; order matches visual flow; no traps"
7,Keyboard-Navigation,KN-002,Implement Tab key navigation,"[]","20min",P0,Frontend-Team-1,pending,"Tab moves focus through interactive elements; logical order"
7,Keyboard-Navigation,KN-003,Implement Enter key on buttons,"[]","10min",P0,Frontend-Team-1,pending,"Enter triggers button click"
7,Keyboard-Navigation,KN-004,Implement Space key on buttons,"[]","10min",P0,Frontend-Team-1,pending,"Space triggers button click"
7,Keyboard-Navigation,KN-005,Implement Escape to close modals,"[]","15min",P0,Frontend-Team-1,pending,"Escape key closes open modals"
7,Keyboard-Navigation,KN-006,Implement arrow keys for list navigation,"[]","30min",P0,Frontend-Team-1,pending,"Arrow keys move focus within lists"
7,Keyboard-Navigation,KN-007,Unit test keyboard navigation,"[KN-001,KN-002,KN-003,KN-004,KN-005,KN-006]","40min",P0,QA-Team-1,pending,"Test covers: all keyboard interactions work; no focus traps"
7,Focus-Management,FM-001,Add visible focus outline (ring),"[DT-001]","20min",P0,Frontend-Team-1,pending,"All interactive elements have visible focus outline; uses token color"
7,Focus-Management,FM-002,Remove default focus outline (replace with custom),"[FM-001]","10min",P0,Frontend-Team-1,pending,"outline: none; replaced with custom focus style"
7,Focus-Management,FM-003,Implement focus trap in modals,"[]","30min",P0,Frontend-Team-2,pending,"Focus cycles within modal; cannot escape with Tab"
7,Focus-Management,FM-004,Implement focus restore on modal close,"[FM-003]","20min",P0,Frontend-Team-2,pending,"Focus returns to triggering element when modal closes"
7,Focus-Management,FM-005,Add skip-to-content link,"[RC-010]","15min",P0,Frontend-Team-1,pending,"Skip link at top of page; jumps to main content"
7,Focus-Management,FM-006,Unit test focus management (react-testing-library),"[FM-001,FM-002,FM-003,FM-004,FM-005]","30min",P0,QA-Team-1,pending,"Test covers: focus visible; trap works; restore works; skip link works"
7,User-Preferences,UP-001,Detect prefers-reduced-motion,"[RC-006,DT-003]","20min",P0,Frontend-Team-1,pending,"Respects prefers-reduced-motion media query"
7,User-Preferences,UP-002,Disable animations for prefers-reduced-motion,"[UP-001,MC-002]","30min",P0,Frontend-Team-2,pending,"All animations disabled/simplified when prefers-reduced-motion active"
7,User-Preferences,UP-003,Detect prefers-color-scheme,"[TS-003]","10min",P0,Frontend-Team-1,pending,"Auto-detect dark/light theme from system preference"
7,User-Preferences,UP-004,Detect prefers-contrast,"[]","20min",P0,Frontend-Team-1,pending,"High contrast mode available for users who need it"
7,User-Preferences,UP-005,Unit test prefers-reduced-motion,"[UP-002]","20min",P0,QA-Team-1,pending,"Test covers: animations disabled when preference active"
7,User-Preferences,UP-006,Unit test prefers-color-scheme,"[UP-003]","15min",P0,QA-Team-1,pending,"Test covers: correct theme used when preference active"
7,User-Preferences,UP-007,Unit test prefers-contrast,"[UP-004]","20min",P0,QA-Team-1,pending,"Test covers: high contrast enabled when preference active"
7,Accessibility-Testing,AT-001,Run axe DevTools scan (full page),"[AA-007,FM-006,UP-007]","20min",P0,QA-Team-1,pending,"axe scan shows 0 ARIA violations; all issues documented"
7,Accessibility-Testing,AT-002,Run WAVE accessibility scan,"[AT-001]","20min",P0,QA-Team-1,pending,"WAVE scan shows green status; all errors fixed"
7,Accessibility-Testing,AT-003,Test with screen reader (VoiceOver),"[AA-007]","30min",P1,QA-Team-1,pending,"VoiceOver reads all content; interactive elements announced"
7,Accessibility-Testing,AT-004,Test with screen reader (NVDA),"[AA-007]","30min",P1,QA-Team-1,pending,"NVDA reads all content; interactive elements announced"
7,Accessibility-Testing,AT-005,Manual keyboard-only navigation test,"[KN-007,FM-006]","30min",P1,QA-Team-1,pending,"Navigate entire page using only keyboard; all features accessible"
7,Accessibility-Testing,AT-006,Manual high-contrast mode test,"[UP-004]","20min",P1,QA-Team-1,pending,"High contrast mode enabled; text readable; colors distinct"
7,Accessibility-Testing,AT-007,Manual reduced-motion test,"[UP-002]","20min",P1,QA-Team-1,pending,"Reduced motion enabled; animations disabled; page still usable"
8,Bundle-Optimization,BO-001,Analyze current bundle size,"[]","15min",P0,Backend-Team,pending,"Run webpack-bundle-analyzer; document baseline size"
8,Bundle-Optimization,BO-002,Code split motion library,"[MU-010]","30min",P0,Frontend-Team-1,pending,"Motion utilities split into separate chunk; lazy loaded"
8,Bundle-Optimization,BO-003,Lazy load modal components,"[RC-001]","30min",P0,Frontend-Team-1,pending,"Modal components split; loaded on demand"
8,Bundle-Optimization,BO-004,Minify CSS-in-JS output,"[SF-011]","20min",P0,Frontend-Team-1,pending,"Style output minified; whitespace removed"
8,Bundle-Optimization,BO-005,Tree-shake unused utilities,"[BO-002,BO-004]","20min",P0,Frontend-Team-1,pending,"Unused motion utilities removed from bundle"
8,Bundle-Optimization,BO-006,Verify bundle size <300KB gzipped,"[BO-005]","15min",P0,QA-Team-1,pending,"Final gzipped bundle less than 300KB"
8,Animation-Performance,AP-001,Use GPU-accelerated properties (transform opacity),"[MC-002,ME-005]","30min",P0,Frontend-Team-2,pending,"All animations use transform and opacity; not left/top/width"
8,Animation-Performance,AP-002,Profile animations with DevTools,"[AP-001]","30min",P1,QA-Team-1,pending,"DevTools Rendering tab: 60 FPS on all animations; no jank"
8,Animation-Performance,AP-003,Remove heavy animations from mobile,"[RM-003,AP-001]","30min",P0,Frontend-Team-2,pending,"Complex animations disabled on mobile if performance drops"
8,Animation-Performance,AP-004,Implement animation performance monitoring,"[AP-002]","30min",P0,Frontend-Team-1,pending,"Console logs FPS metrics; alerts if drops below 55 FPS"
8,Image-Optimization,IO-001,Lazy load images on product cards,"[]","30min",P0,Frontend-Team-1,pending,"Images use loading=lazy attribute; start below viewport"
8,Image-Optimization,IO-002,Use responsive images (srcset),"[]","30min",P0,Frontend-Team-1,pending,"Image tags include srcset for multiple resolutions"
8,Image-Optimization,IO-003,Compress and optimize SVGs,"[]","20min",P0,Frontend-Team-1,pending,"SVGs optimized with svgo; no unnecessary elements"
8,Image-Optimization,IO-004,Use WebP with fallbacks,"[]","30min",P0,Frontend-Team-1,pending,"WebP images served where supported; PNG fallback for others"
8,Web-Vitals,WV-001,Add Web Vitals monitoring,"[]","30min",P0,Frontend-Team-1,pending,"web-vitals library integrated; metrics sent to analytics"
8,Web-Vitals,WV-002,Measure LCP (Largest Contentful Paint),"[WV-001]","20min",P0,QA-Team-1,pending,"LCP measured; target <2.5s"
8,Web-Vitals,WV-003,Measure FID (First Input Delay),"[WV-001]","20min",P0,QA-Team-1,pending,"FID measured; target <100ms"
8,Web-Vitals,WV-004,Measure CLS (Cumulative Layout Shift),"[WV-001]","20min",P0,QA-Team-1,pending,"CLS measured; target <0.1"
8,Web-Vitals,WV-005,Alert on metric degradation,"[WV-002,WV-003,WV-004]","30min",P0,Frontend-Team-1,pending,"Console warning if any metric exceeds target"
8,Lighthouse-Testing,LT-001,Run Lighthouse audit (desktop),"[BO-006,AP-002,WV-005]","20min",P1,QA-Team-1,pending,"Lighthouse score ≥90; all categories 90+"
8,Lighthouse-Testing,LT-002,Run Lighthouse audit (mobile),"[BO-006,AP-003,WV-005]","20min",P1,QA-Team-1,pending,"Lighthouse score ≥80 on mobile; performance ≥70"
8,Lighthouse-Testing,LT-003,Verify LCP <2.5s,"[LT-001]","15min",P1,QA-Team-1,pending,"Lighthouse LCP metric <2.5 seconds"
8,Lighthouse-Testing,LT-004,Verify FID <100ms,"[LT-001]","15min",P1,QA-Team-1,pending,"Lighthouse FID metric <100 milliseconds"
8,Lighthouse-Testing,LT-005,Verify CLS <0.1,"[LT-001]","15min",P1,QA-Team-1,pending,"Lighthouse CLS metric <0.1"
9,Unit-Tests,UT-001,Unit test design-tokens.js,"[DT-008]","Already completed","P0,QA-Team-1,done,"Tests passing; all tokens validated"
9,Unit-Tests,UT-002,Unit test motion-utils.js,"[MU-010]","Already completed","P0,QA-Team-1,done,"Tests passing; all utilities validated"
9,Unit-Tests,UT-003,Unit test style-factory.js,"[SF-011]","Already completed","P0,QA-Team-1,done,"Tests passing; all functions validated"
9,Unit-Tests,UT-004,Unit test API client,"[AC-012,EC-007]","Already completed","P0,QA-Team-1,done,"Tests passing; all error cases covered"
9,Unit-Tests,UT-005,Unit test all React components,"[CM-008]","Already completed","P0,QA-Team-1,done,"Tests passing; all components validated"
9,Unit-Tests,UT-006,Unit test all motion components,"[MC-016]","Already completed","P0,QA-Team-1,done,"Tests passing; all animations validated"
9,Unit-Tests,UT-007,Unit test all loading components,"[LS-015]","Already completed","P0,QA-Team-1,done,"Tests passing; all states validated"
9,Unit-Tests,UT-008,Unit test all error components,"[ES-015]","Already completed","P0,QA-Team-1,done,"Tests passing; all error types covered"
9,Component-Tests,CT-001,Component test Layout.jsx,"[RC-013]","Already completed","P0,QA-Team-1,done,"Tests passing; layout behavior verified"
9,Component-Tests,CT-002,Component test all motion components,"[MC-016]","Already completed","P0,QA-Team-1,done,"Tests passing; animations render correctly"
9,Component-Tests,CT-003,Component test ErrorState variants,"[ES-015]","Already completed","P0,QA-Team-1,done,"Tests passing; all error states render"
9,Component-Tests,CT-004,Component test EmptyState variants,"[EM-006]","Already completed","P0,QA-Team-1,done,"Tests passing; all empty states render"
9,Component-Tests,CT-005,Component test form components,"[CM-008]","Already completed","P0,QA-Team-1,done,"Tests passing; form interactions work"
9,Integration-Tests,IT-001,Integration test full diagnosis workflow,"[API-004,CM-005]","60min",P0,QA-Team-1,pending,"Submit form → API call → results display → complete"
9,Integration-Tests,IT-002,Integration test error recovery workflow,"[API-003,ES-001]","45min",P0,QA-Team-1,pending,"API error → ErrorState → retry → success"
9,Integration-Tests,IT-003,Integration test theme switching workflow,"[TS-005,TT-003]","30min",P0,QA-Team-1,pending,"Click theme toggle → theme changes → localStorage persists"
9,Integration-Tests,IT-004,Integration test loading state workflow,"[LS-001,CM-005]","30min",P0,QA-Team-1,pending,"Form submission → skeleton loading → content replaces skeleton"
9,Integration-Tests,IT-005,Integration test timeout and retry workflow,"[TH-004,RL-004,API-003]","45min",P0,QA-Team-1,pending,"Request timeout → error shown → manual retry succeeds"
9,E2E-Tests,ET-001,E2E test landing page loads,"[]","20min",P0,QA-Team-2,pending,"npm start; localhost:3000/index.html loads; no console errors"
9,E2E-Tests,ET-002,E2E test can submit diagnosis,"[ET-001,API-001]","30min",P0,QA-Team-2,pending,"Enter incident text; click submit; API called; response received"
9,E2E-Tests,ET-003,E2E test can see results,"[ET-002,CM-005]","30min",P0,QA-Team-2,pending,"Results display all 4 agent outputs; sections visible"
9,E2E-Tests,ET-004,E2E test can toggle theme,"[ET-001,TS-005]","20min",P0,QA-Team-2,pending,"Click theme toggle; theme switches; persists on reload"
9,E2E-Tests,ET-005,E2E test error recovery (retry),"[ET-002,API-003]","30min",P0,QA-Team-2,pending,"Simulate API error; error shown; click retry; succeeds"
9,E2E-Tests,ET-006,E2E test keyboard navigation,"[ET-001,KN-007]","20min",P0,QA-Team-2,pending,"Tab through page; all interactive elements accessible"
9,E2E-Tests,ET-007,E2E test mobile layout,"[ET-001,RM-001]","20min",P0,QA-Team-2,pending,"Resize to mobile; layout responsive; buttons clickable"
9,E2E-Tests,ET-008,E2E test animations (60 FPS),"[ET-001,AP-002]","20min",P1,QA-Team-2,pending,"DevTools Rendering shows 60 FPS on all animations"
9,Visual-Regression,VR-001,Take baseline screenshots (light theme),"[TT-001]","30min",P0,QA-Team-1,pending,"Screenshots of all pages in light theme"
9,Visual-Regression,VR-002,Take baseline screenshots (dark theme),"[TT-002]","30min",P0,QA-Team-1,pending,"Screenshots of all pages in dark theme"
9,Visual-Regression,VR-003,Compare new screenshots to baseline (light),"[VR-001]","20min",P1,QA-Team-1,pending,"Visual regression test passes; no unexpected changes"
