PHASE,COMPONENT,TASK_ID,TASK_NAME,DEPENDENCIES,EST_TIME,PRIORITY,OWNER,STATUS,SUCCESS_CRITERIA
1,Design-Tokens,DT-001,Create color palette tokens (primary secondary accent),[],"30min",P0,Design-Team,pending,"tokens.colors object contains minimum 8 colors; all colors have hex values"
1,Design-Tokens,DT-002,Create typography scale tokens (h1-h6 body small),"[DT-001]","20min",P0,Design-Team,pending,"tokens.typography object contains all sizes weights line-heights; all values valid CSS"
1,Design-Tokens,DT-003,Create motion tokens (quick smooth dramatic),"[DT-001]","20min",P0,Design-Team,pending,"tokens.motion object has 3+ named animations with duration and easing"
1,Design-Tokens,DT-004,Create spacing scale tokens (4 8 16 24 32),"[DT-001]","15min",P0,Design-Team,pending,"tokens.spacing array has 5+ values in pixels"
1,Design-Tokens,DT-005,Create shadow elevation tokens (1-5 levels),"[DT-001]","15min",P0,Design-Team,pending,"tokens.shadows object has 5 elevation levels with valid box-shadow CSS"
1,Design-Tokens,DT-006,Create border-radius tokens (small medium large),"[DT-001]","10min",P0,Design-Team,pending,"tokens.borderRadius object has at least 3 radius values"
1,Design-Tokens,DT-007,Create design-tokens.js export file,"[DT-001,DT-002,DT-003,DT-004,DT-005,DT-006]","20min",P0,Frontend-Team-1,pending,"File exists at src/www/design-tokens.js and exports valid JS object"
1,Design-Tokens,DT-008,Write design tokens unit tests (color contrast WCAG AA),"[DT-007]","45min",P0,QA-Team-1,pending,"Test file passes; all colors have 4.5:1+ contrast ratio; motion values valid CSS"
1,Design-Tokens,DT-009,Verify all tokens are referenced in no existing code,"[DT-007]","20min",P0,Frontend-Team-1,pending,"Grep search shows no hardcoded color spacing motion values in existing components"
1,Design-Tokens,DT-010,Document token structure in CLAUDE.md,"[DT-007]","30min",P0,Documentation-Team,pending,"CLAUDE.md updated with token definitions usage examples"
1,Motion-Utilities,MU-001,Create motion-utils.js file,"[DT-003,DT-007]","20min",P0,Frontend-Team-1,pending,"File exists at src/www/motion-utils.js and exports functions"
1,Motion-Utilities,MU-002,Implement staggerAnimation utility function,"[MU-001,DT-003]","30min",P0,Frontend-Team-1,pending,"Function takes count and delayStep; returns array with correct delay values"
1,Motion-Utilities,MU-003,Implement generateKeyframes utility function,"[MU-001,DT-003]","30min",P0,Frontend-Team-1,pending,"Function generates valid CSS keyframes from animation name and tokens"
1,Motion-Utilities,MU-004,Implement delayedAnimation utility function,"[MU-001,DT-003]","20min",P0,Frontend-Team-1,pending,"Function applies delay to animation based on token duration"
1,Motion-Utilities,MU-005,Implement easeAnimation utility function,"[MU-001,DT-003]","20min",P0,Frontend-Team-1,pending,"Function applies easing from tokens to animation"
1,Motion-Utilities,MU-006,Unit test staggerAnimation function,"[MU-002]","30min",P0,QA-Team-1,pending,"Test covers: correct count; correct delay increments; array length"
1,Motion-Utilities,MU-007,Unit test generateKeyframes function,"[MU-003]","30min",P0,QA-Team-1,pending,"Test covers: valid keyframes output; token values applied; CSS validity"
1,Motion-Utilities,MU-008,Unit test delayedAnimation function,"[MU-004]","20min",P0,QA-Team-1,pending,"Test covers: token duration applied; delay calculation correct"
1,Motion-Utilities,MU-009,Unit test easeAnimation function,"[MU-005]","20min",P0,QA-Team-1,pending,"Test covers: token easing applied; valid CSS easing value"
1,Motion-Utilities,MU-010,Integration test motion utilities with design tokens,"[MU-006,MU-007,MU-008,MU-009,DT-008]","30min",P0,QA-Team-1,pending,"All motion utilities reference tokens correctly; no hardcoded values"
1,Style-Factory,SF-001,Create style-factory.js file,"[DT-007,MU-010]","20min",P0,Frontend-Team-1,pending,"File exists at src/www/style-factory.js and exports functions"
1,Style-Factory,SF-002,Implement generateThemeStyles function (light mode),"[SF-001,DT-001]","40min",P0,Frontend-Team-1,pending,"Function returns valid CSS object for light theme using tokens"
1,Style-Factory,SF-003,Implement generateThemeStyles function (dark mode),"[SF-002,DT-001]","40min",P0,Frontend-Team-1,pending,"Function returns valid CSS object for dark theme with high contrast"
1,Style-Factory,SF-004,Implement createResponsiveStyles function,"[SF-001,DT-004]","40min",P0,Frontend-Team-1,pending,"Function generates media queries using tokens for tablet and mobile breakpoints"
1,Style-Factory,SF-005,Implement applyThemeToElement function,"[SF-001,DT-001]","30min",P0,Frontend-Team-1,pending,"Function sets CSS variables or inline styles on DOM element"
1,Style-Factory,SF-006,Implement getContrastRatio function,"[SF-001,DT-001]","30min",P0,Frontend-Team-1,pending,"Function calculates contrast ratio between two colors; validates WCAG AA"
1,Style-Factory,SF-007,Unit test generateThemeStyles light mode,"[SF-002]","30min",P0,QA-Team-1,pending,"Test covers: all theme colors applied; valid CSS output; no errors"
1,Style-Factory,SF-008,Unit test generateThemeStyles dark mode,"[SF-003]","30min",P0,QA-Team-1,pending,"Test covers: dark colors applied; contrast ratios verified; readability confirmed"
1,Style-Factory,SF-009,Unit test createResponsiveStyles function,"[SF-004]","30min",P0,QA-Team-1,pending,"Test covers: correct media queries; token values applied; breakpoints correct"
1,Style-Factory,SF-010,Unit test getContrastRatio function,"[SF-006]","30min",P0,QA-Team-1,pending,"Test covers: known color pairs; WCAG AA threshold validation; edge cases"
1,Style-Factory,SF-011,Integration test style factory with tokens,"[SF-007,SF-008,SF-009,SF-010,DT-008]","30min",P0,QA-Team-1,pending,"All styles reference tokens; no hardcoded values; all tests pass"
1,Style-Factory,SF-012,Manual test light theme appearance (desktop),"[SF-002,SF-007]","20min",P0,QA-Team-1,pending,"Open browser; verify all colors match tokens; check contrast with axe DevTools"
1,Style-Factory,SF-013,Manual test dark theme appearance (desktop),"[SF-003,SF-008]","20min",P0,QA-Team-1,pending,"Open browser; verify dark colors applied; check contrast 4.5:1 minimum"
1,Design-System,DS-001,Create design-system documentation file,"[DT-010,MU-010,SF-011]","30min",P0,Documentation-Team,pending,"Document created with token structure utility functions and usage examples"
2,React-Core,RC-001,Create App.jsx component wrapper,"[]","30min",P0,Frontend-Team-2,pending,"File exists at src/www/App.jsx and exports React component"
2,React-Core,RC-002,Implement React Context for ThemeProvider,"[RC-001,DT-007]","30min",P0,Frontend-Team-2,pending,"ThemeContext.jsx created; exports ThemeProvider and useTheme hook"
2,React-Core,RC-003,Implement React Context for UIStateProvider,"[RC-001]","30min",P0,Frontend-Team-2,pending,"UIStateContext.jsx created; exports UIStateProvider and useUIState hook"
2,React-Core,RC-004,Create useTheme custom hook,"[RC-002]","20min",P0,Frontend-Team-2,pending,"Hook allows access to current theme and setTheme function"
2,React-Core,RC-005,Create useUIState custom hook,"[RC-003]","20min",P0,Frontend-Team-2,pending,"Hook allows access to UI state (loading error success) and update functions"
2,React-Core,RC-006,Create useReducedMotion custom hook,"[DT-003]","20min",P0,Frontend-Team-2,pending,"Hook respects prefers-reduced-motion media query; returns boolean"
2,React-Core,RC-007,Unit test ThemeContext,"[RC-002,RC-004]","30min",P0,QA-Team-1,pending,"Test covers: provider renders; hook works; theme changes propagate"
2,React-Core,RC-008,Unit test UIStateContext,"[RC-003,RC-005]","30min",P0,QA-Team-1,pending,"Test covers: provider renders; hook works; state changes propagate"
2,React-Core,RC-009,Unit test useReducedMotion hook,"[RC-006]","20min",P0,QA-Team-1,pending,"Test covers: correct media query detection; boolean value returned"
2,React-Core,RC-010,Create Layout component (header footer main),"[RC-001,RC-002]","45min",P0,Frontend-Team-2,pending,"Layout.jsx created; has header main footer sections; uses tokens for spacing"
2,React-Core,RC-011,Implement sticky header in Layout,"[RC-010]","30min",P0,Frontend-Team-2,pending,"Header sticks to top on scroll; z-index correct; shadow applied"
2,React-Core,RC-012,Create ThemeToggle component,"[RC-004]","30min",P0,Frontend-Team-2,pending,"Component renders toggle button; calls useTheme setTheme; label accessible"
2,React-Core,RC-013,Unit test Layout component,"[RC-010,RC-011]","30min",P0,QA-Team-1,pending,"Test covers: renders with children; header sticky; footer visible"
2,React-Core,RC-014,Unit test ThemeToggle component,"[RC-012,RC-004]","20min",P0,QA-Team-1,pending,"Test covers: renders correctly; click changes theme; ARIA labels present"
2,React-Core,RC-015,Integration test theme switching,"[RC-014,RC-004]","30min",P0,QA-Team-1,pending,"Click toggle; verify useTheme hook updates; verify Layout reflects new theme"
2,React-Integration,RI-001,Create index.jsx entry point file,"[RC-001,RC-002,RC-003]","20min",P0,Frontend-Team-2,pending,"File exists at src/www/index.jsx; renders React app to DOM"
2,React-Integration,RI-002,Update public/index.html to use React root,"[RI-001]","20min",P0,Frontend-Team-2,pending,"index.html has div#root; loads src/www/index.jsx; no console errors"
2,React-Integration,RI-003,Create ErrorBoundary component,"[RC-001]","30min",P0,Frontend-Team-2,pending,"Component catches React errors; displays user-friendly message; has fallback UI"
2,React-Integration,RI-004,Unit test ErrorBoundary component,"[RI-003]","20min",P0,QA-Team-1,pending,"Test covers: error caught; fallback UI displayed; no cascade errors"
2,React-Integration,RI-005,Wrap App with ErrorBoundary,"[RI-003,RC-001]","10min",P0,Frontend-Team-2,pending,"App.jsx wrapped with ErrorBoundary; all errors caught"
2,React-Integration,RI-006,Verify React development tools work,"[RI-002,RI-005]","15min",P0,Frontend-Team-1,pending,"React DevTools browser extension works; component tree visible; hooks visible"
2,React-Integration,RI-007,Test React app loads without errors,"[RI-002,RI-005]","15min",P0,QA-Team-1,pending,"npm start runs; localhost:3000 loads; no console errors; React app mounts"
2,Component-Migration,CM-001,Migrate ErrorBoundary to use React Context,"[RI-003,RC-002]","20min",P0,Frontend-Team-2,pending,"Component accesses UIState context; updates on error state changes"
2,Component-Migration,CM-002,Migrate LoadingOverlay to use React Context,"[RC-003,RC-005]","30min",P0,Frontend-Team-2,pending,"Component accesses UIState context; respects prefers-reduced-motion"
2,Component-Migration,CM-003,Migrate NavigationBar to use React Context,"[RC-002,RC-004]","30min",P0,Frontend-Team-2,pending,"Component accesses theme context; renders theme toggle button"
2,Component-Migration,CM-004,Migrate DiagnosisForm to use React Context,"[RC-003,RC-005]","30min",P0,Frontend-Team-2,pending,"Component accesses UIState context; dispatches actions on submit"
2,Component-Migration,CM-005,Migrate ResultsDisplay to use React Context,"[RC-003,RC-005]","30min",P0,Frontend-Team-2,pending,"Component accesses UIState context; renders based on state"
2,Component-Migration,CM-006,Migrate DashboardPanel to use React Context,"[RC-003,RC-005]","30min",P0,Frontend-Team-2,pending,"Component accesses UIState context; collapses on small screens"
2,Component-Migration,CM-007,Migrate PipelineVisualization to use React Context,"[RC-003,RC-005]","30min",P0,Frontend-Team-2,pending,"Component accesses UIState context; shows pipeline stages"
2,Component-Migration,CM-008,Unit test all migrated components,"[CM-001,CM-002,CM-003,CM-004,CM-005,CM-006,CM-007]","60min",P0,QA-Team-1,pending,"All component tests pass; context values accessible; no console errors"
2,Component-Migration,CM-009,Integration test all components together,"[CM-008]","45min",P0,QA-Team-1,pending,"All components render in isolation; render together without errors"
3,Motion-Components,MC-001,Create AnimatedSection component,"[DT-003,MU-010,RC-001]","40min",P0,Frontend-Team-2,pending,"Component renders with scroll-triggered animation; uses IntersectionObserver"
3,Motion-Components,MC-002,Create FadeIn component,"[DT-003,MU-010,RC-001]","30min",P0,Frontend-Team-2,pending,"Component renders with fade-in animation; accepts delay and duration props"
3,Motion-Components,MC-003,Create ZoomIn component,"[DT-003,MU-010,RC-001]","30min",P0,Frontend-Team-2,pending,"Component renders with zoom animation; accepts scale and duration props"
3,Motion-Components,MC-004,Create ScaleUp component,"[DT-003,MU-010,RC-001]","30min",P0,Frontend-Team-2,pending,"Component renders with scale-up animation; uses transform for GPU acceleration"
3,Motion-Components,MC-005,Create SlideIn component,"[DT-003,MU-010,RC-001]","30min",P0,Frontend-Team-2,pending,"Component renders with slide-in animation; direction prop (top left right bottom)"
3,Motion-Components,MC-006,Create StaggerList component,"[DT-003,MU-010,RC-001]","40min",P0,Frontend-Team-2,pending,"Component applies stagger animation to children; accepts delayStep prop"
3,Motion-Components,MC-007,Create ParallaxLayer component,"[DT-003,MU-010,RC-001]","40min",P0,Frontend-Team-2,pending,"Component applies parallax effect; uses scroll position; smooth at 60 FPS"
3,Motion-Components,MC-008,Implement scroll-to-animate logic for AnimatedSection,"[MC-001,RC-006]","40min",P0,Frontend-Team-2,pending,"AnimatedSection fires animation when scrolled into view; respects prefers-reduced-motion"
3,Motion-Components,MC-009,Unit test AnimatedSection component,"[MC-001,MC-008]","30min",P0,QA-Team-1,pending,"Test covers: renders children; IntersectionObserver called; animation fires"
3,Motion-Components,MC-010,Unit test FadeIn component,"[MC-002]","20min",P0,QA-Team-1,pending,"Test covers: renders correctly; animation applied; props work"
3,Motion-Components,MC-011,Unit test ZoomIn component,"[MC-003]","20min",P0,QA-Team-1,pending,"Test covers: renders correctly; animation applied; props work"
3,Motion-Components,MC-012,Unit test ScaleUp component,"[MC-004]","20min",P0,QA-Team-1,pending,"Test covers: renders correctly; animation applied; transform used"
3,Motion-Components,MC-013,Unit test SlideIn component,"[MC-005]","20min",P0,QA-Team-1,pending,"Test covers: renders correctly; animation applied; direction prop works"
3,Motion-Components,MC-014,Unit test StaggerList component,"[MC-006]","30min",P0,QA-Team-1,pending,"Test covers: children rendered; stagger applied correctly; timing correct"
3,Motion-Components,MC-015,Unit test ParallaxLayer component,"[MC-007]","30min",P0,QA-Team-1,pending,"Test covers: renders correctly; scroll listener attached; parallax applied"
3,Motion-Components,MC-016,Integration test all motion components,"[MC-009,MC-010,MC-011,MC-012,MC-013,MC-014,MC-015]","45min",P0,QA-Team-1,pending,"All tests pass; no animation conflicts; motion utils used correctly"
3,Motion-Components,MC-017,Visual test AnimatedSection on scroll (manual),"[MC-008,MC-009]","20min",P1,QA-Team-1,pending,"Scroll page; verify animation fires at correct point; smooth at 60 FPS"
3,Motion-Components,MC-018,Visual test ParallaxLayer depth (manual),"[MC-007,MC-015]","20min",P1,QA-Team-1,pending,"Scroll page; verify parallax layers move at different speeds; effect visible"
3,Motion-Components,MC-019,Visual test StaggerList animation (manual),"[MC-006,MC-014]","20min",P1,QA-Team-1,pending,"Verify list items animate in sequence; delay increases per item; smooth at 60 FPS"
3,Motion-Enhancement,ME-001,Update existing animations to use tokens,"[DT-003,MU-010]","60min",P0,Frontend-Team-1,pending,"All hardcoded animation values replaced with token references"
3,Motion-Enhancement,ME-002,Convert index.html inline styles to use tokens,"[DT-001,DT-004]","60min",P0,Frontend-Team-1,pending,"All hardcoded color spacing values replaced with token references"
3,Motion-Enhancement,ME-003,Add micro-interaction hover states,"[MC-002,DT-003,SF-001]","45min",P0,Frontend-Team-2,pending,"Buttons/cards scale and shadow on hover; smooth 150ms transition"
3,Motion-Enhancement,ME-004,Add micro-interaction focus states,"[RC-010,DT-003]","30min",P0,Frontend-Team-2,pending,"All interactive elements have visible focus outline; uses tokens"
3,Motion-Enhancement,ME-005,Add micro-interaction click feedback,"[DT-003]","30min",P0,Frontend-Team-2,pending,"Elements scale down on click; feedback clear; respects prefers-reduced-motion"
3,Motion-Enhancement,ME-006,Add micro-interaction drag feedback,"[DT-003,DT-001]","30min",P0,Frontend-Team-2,pending,"Cursor changes on drag; visual feedback clear; smooth at 60 FPS"
3,Motion-Enhancement,ME-007,Add motion to form field validation,"[DT-003]","30min",P0,Frontend-Team-2,pending,"Errors animate in; success feedback animates; clear to user"
3,Motion-Enhancement,ME-008,Visual test all hover states (manual),"[ME-003]","20min",P1,QA-Team-1,pending,"Hover over all buttons cards links; verify scale and shadow applied"
3,Motion-Enhancement,ME-009,Visual test all focus states (manual),"[ME-004]","20min",P1,QA-Team-1,pending,"Tab through all interactive elements; verify focus outline visible"
3,Motion-Enhancement,ME-010,Visual test all click feedback (manual),"[ME-005]","20min",P1,QA-Team-1,pending,"Click buttons; verify scale feedback; feedback clear and responsive"
4,Loading-States,LS-001,Create Skeleton component,"[DT-004,RC-001]","30min",P0,Frontend-Team-2,pending,"Component renders placeholder skeleton; uses tokens for spacing"
4,Loading-States,LS-002,Create SkeletonText variant,"[LS-001]","20min",P0,Frontend-Team-2,pending,"Renders multiple skeleton lines; adjustable line count"
4,Loading-States,LS-003,Create SkeletonCard variant,"[LS-001,DT-004]","20min",P0,Frontend-Team-2,pending,"Renders card skeleton with header and content area"
4,Loading-States,LS-004,Create SkeletonList variant,"[LS-001,LS-002]","20min",P0,Frontend-Team-2,pending,"Renders multiple skeleton items; adjustable item count"
4,Loading-States,LS-005,Create ProgressBar component,"[DT-003,RC-001]","30min",P0,Frontend-Team-2,pending,"Component displays animated progress indicator; accepts percentage prop"
4,Loading-States,LS-006,Create StepProgressBar component,"[DT-003,RC-001]","40min",P0,Frontend-Team-2,pending,"Component shows 4-step progress (Router Retriever Skeptic Verifier)"
4,Loading-States,LS-007,Create LoadingAnimation component,"[MC-002,DT-003]","20min",P0,Frontend-Team-2,pending,"Component shows spinner or skeleton; smooth at 60 FPS"
4,Loading-States,LS-008,Unit test Skeleton component,"[LS-001]","20min",P0,QA-Team-1,pending,"Test covers: renders skeleton; children not shown; animation smooth"
4,Loading-States,LS-009,Unit test SkeletonText variant,"[LS-002]","15min",P0,QA-Team-1,pending,"Test covers: correct number of lines; spacing correct; animation smooth"
4,Loading-States,LS-010,Unit test SkeletonCard variant,"[LS-003]","15min",P0,QA-Team-1,pending,"Test covers: card structure; content area; animation smooth"
4,Loading-States,LS-011,Unit test SkeletonList variant,"[LS-004]","15min",P0,QA-Team-1,pending,"Test covers: correct item count; spacing; stagger animation"
4,Loading-States,LS-012,Unit test ProgressBar component,"[LS-005]","20min",P0,QA-Team-1,pending,"Test covers: percentage applied; visual bar filled correctly; smooth"
4,Loading-States,LS-013,Unit test StepProgressBar component,"[LS-006]","20min",P0,QA-Team-1,pending,"Test covers: 4 steps shown; current step highlighted; labels visible"
4,Loading-States,LS-014,Unit test LoadingAnimation component,"[LS-007]","15min",P0,QA-Team-1,pending,"Test covers: renders spinner; smooth animation; respects prefers-reduced-motion"
4,Loading-States,LS-015,Integration test loading components,"[LS-008,LS-009,LS-010,LS-011,LS-012,LS-013,LS-014]","30min",P0,QA-Team-1,pending,"All loading components work together; no animation conflicts"
4,Loading-States,LS-016,Visual test Skeleton loading (manual),"[LS-001,LS-008]","15min",P1,QA-Team-1,pending,"Skeleton shows before content; fades to content; smooth transition"
4,Loading-States,LS-017,Visual test ProgressBar animation (manual),"[LS-005,LS-012]","15min",P1,QA-Team-1,pending,"Progress bar fills smoothly; percentage accurate; 60 FPS"
4,Loading-States,LS-018,Visual test StepProgressBar animation (manual),"[LS-006,LS-013]","15min",P1,QA-Team-1,pending,"4 steps shown; current step highlighted; smooth transitions"
4,Error-States,ES-001,Create ErrorState component,"[DT-001,RC-001]","30min",P0,Frontend-Team-2,pending,"Component displays error message; recovery action button; icon"
4,Error-States,ES-002,Create ErrorBoundaryFallback variant,"[ES-001]","20min",P0,Frontend-Team-2,pending,"Displays React error fallback; user-friendly message; suggest refresh"
4,Error-States,ES-003,Create NetworkErrorState variant,"[ES-001]","20min",P0,Frontend-Team-2,pending,"Displays network error; retry button; timeout indicator"
4,Error-States,ES-004,Create TimeoutErrorState variant,"[ES-001]","20min",P0,Frontend-Team-2,pending,"Displays timeout message; manual retry button; countdown timer"
4,Error-States,ES-005,Create ValidationErrorState variant,"[ES-001]","20min",P0,Frontend-Team-2,pending,"Displays validation errors; links to problem fields; clear guidance"
4,Error-States,ES-006,Create RateLimitErrorState variant,"[ES-001]","20min",P0,Frontend-Team-2,pending,"Displays rate limit message; shows wait time; auto-retry countdown"
4,Error-States,ES-007,Create OfflineState component,"[DT-001,RC-001]","20min",P0,Frontend-Team-2,pending,"Component detects offline status; displays message; shows reconnection status"
4,Error-States,ES-008,Unit test ErrorState component,"[ES-001]","20min",P0,QA-Team-1,pending,"Test covers: renders correctly; action button works; icon displays"
4,Error-States,ES-009,Unit test ErrorBoundaryFallback variant,"[ES-002]","15min",P0,QA-Team-1,pending,"Test covers: error message shown; refresh suggestion; no cascade errors"
4,Error-States,ES-010,Unit test NetworkErrorState variant,"[ES-003]","15min",P0,QA-Team-1,pending,"Test covers: network error message; retry button works; accessible"
4,Error-States,ES-011,Unit test TimeoutErrorState variant,"[ES-004]","15min",P0,QA-Team-1,pending,"Test covers: timeout message; countdown timer works; retry button"
4,Error-States,ES-012,Unit test ValidationErrorState variant,"[ES-005]","15min",P0,QA-Team-1,pending,"Test covers: errors listed; field links work; guidance clear"
4,Error-States,ES-013,Unit test RateLimitErrorState variant,"[ES-006]","15min",P0,QA-Team-1,pending,"Test covers: rate limit message; countdown correct; auto-retry"
4,Error-States,ES-014,Unit test OfflineState component,"[ES-007]","15min",P0,QA-Team-1,pending,"Test covers: offline detected; message shown; reconnection detected"
4,Error-States,ES-015,Integration test error components,"[ES-008,ES-009,ES-010,ES-011,ES-012,ES-013,ES-014]","30min",P0,QA-Team-1,pending,"All error states work; no conflicts; messages clear"
4,Empty-States,EM-001,Create EmptyState component,"[DT-001,RC-001]","20min",P0,Frontend-Team-2,pending,"Component displays when no results; encouraging message; call to action"
4,Empty-States,EM-002,Create EmptySearchResults variant,"[EM-001]","15min",P0,Frontend-Team-2,pending,"Suggests search refinement; shows example queries; link to help"
4,Empty-States,EM-003,Create EmptyHistoryState variant,"[EM-001]","15min",P0,Frontend-Team-2,pending,"Suggests first action; encouragement; next steps button"
4,Empty-States,EM-004,Unit test EmptyState component,"[EM-001]","15min",P0,QA-Team-1,pending,"Test covers: renders correctly; message visible; button works"
4,Empty-States,EM-005,Unit test EmptySearchResults variant,"[EM-002]","15min",P0,QA-Team-1,pending,"Test covers: suggestions shown; example queries; help link"
4,Empty-States,EM-006,Unit test EmptyHistoryState variant,"[EM-003]","15min",P0,QA-Team-1,pending,"Test covers: encouragement shown; action button works; next steps clear"
4,Sticky-Sections,ST-001,Create StickySection component,"[RC-001,DT-004]","30min",P0,Frontend-Team-2,pending,"Component sticks to viewport when scrolled; respects viewport bounds"
4,Sticky-Sections,ST-002,Create StickyCTA (Call-to-Action) component,"[ST-001,MC-002]","30min",P0,Frontend-Team-2,pending,"Call-to-action button sticks to screen; fades in/out based on scroll"
4,Sticky-Sections,ST-003,Create StickyComparisonTable component,"[ST-001,DT-004]","40min",P0,Frontend-Team-2,pending,"Feature comparison table stays visible; scrolls within sticky area"
4,Sticky-Sections,ST-004,Unit test StickySection component,"[ST-001]","20min",P0,QA-Team-1,pending,"Test covers: sticks to viewport; respects bounds; doesn't overlap"
4,Sticky-Sections,ST-005,Unit test StickyCTA component,"[ST-002]","20min",P0,QA-Team-1,pending,"Test covers: button sticks; animation smooth; opacity correct"
4,Sticky-Sections,ST-006,Unit test StickyComparisonTable component,"[ST-003]","20min",P0,QA-Team-1,pending,"Test covers: table sticks; internal scroll works; no layout shift"
4,Sticky-Sections,ST-007,Visual test sticky sections (manual),"[ST-004,ST-005,ST-006]","20min",P1,QA-Team-1,pending,"Scroll page; verify sections stick; no layout shift; smooth"
4,Premium-UI-Integration,PUI-001,Wire SkeletonList to DiagnosisForm,"[LS-004,CM-004]","20min",P0,Frontend-Team-2,pending,"Loading skeleton shows while form initializing"
4,Premium-UI-Integration,PUI-002,Wire StepProgressBar to ResultsDisplay,"[LS-006,CM-005]","20min",P0,Frontend-Team-2,pending,"Progress bar shows 4-agent pipeline stages"
4,Premium-UI-Integration,PUI-003,Wire ErrorState to API errors,"[ES-001,RC-003]","20min",P0,Frontend-Team-2,pending,"Error state displays on API failure; matches error type"
4,Premium-UI-Integration,PUI-004,Wire OfflineState to network status,"[ES-007,RC-003]","20min",P0,Frontend-Team-2,pending,"Offline state shows when network disconnected; auto-detects reconnection"
